code,description
28750,Fusion of big toe at joint with foot
28755,Fusion of big toe between toe joints
28760,Fusion of big toe between toe joints with tendon transfer
28800,Amputation of midfoot bone
28805,Amputation of foot across instep
28810,Amputation of toe and midfoot bone
28820,Amputation of toe at joint between forefoot and toes
28825,Amputation of toe at toe joint
28890,Shock wave therapy to arch of foot using ultrasound guidance under anesthesia
28899,Other procedure on foot or toes
29049,Application of figure-of-eight cast
29055,Application of shoulder spica cast
29065,Application of shoulder to hand cast
29075,Application of elbow to finger cast
29085,Application of hand and lower forearm cast
29086,Application of finger cast
29105,Application of lower and upper arm splint
29125,Application of nonmoveable forearm to hand splint
29126,Application of moveable or hinged forearm to hand splint
29130,Application of nonmoveable finger splint
29131,Application of hinged finger splint
29200,Placement of strapping to chest
29240,Placement of strapping to shoulder
29260,Placement of strapping to elbow or wrist
29280,Placement of strapping to hand or finger
29345,Application of long leg cast from thigh to toe
29355,Application of walking cast covering thigh to toe
29358,Application of long leg brace-type cast from thigh to toe
29365,Application of thigh to lower leg cylinder cast
29405,Application of short leg cast
29425,Application of walking cast covering below knee to toe
29435,Application of kneecap tendon bearing cast
29440,Addition of walker to previously applied cast
29445,"Application of walking cast covering foot, ankle, and lower leg"
29450,Application of leg cast and manipulation of foot to treat deformity
29505,Application of long leg splint from thigh to ankle or toe
29515,Application of short leg splint from calf to foot
29520,Placement of strapping to hip
29530,Placement of strapping to knee
29540,Placement of strapping to ankle or foot
29550,Placement of strapping to toes
29580,"Strapping, unna boot"
29581,"Application of vein wound compression bandages on lower leg, ankle, and foot"
29584,"Application of vein wound compression bandages on upper arm, forearm, hand, and fingers"
29700,"Removal or cutting of gauntlet, boot, or body cast"
29705,Removal or cutting of full arm or leg cast
29730,Exam of skin surface by creation of opening in cast
29740,Insertion of wedge in cast
29799,Other casting or wrapping procedure
29800,Diagnostic exam of jaw joint using an endoscope
29804,Exam of jaw joint using an endoscope
29805,Diagnostic exam of shoulder using an endoscope
29806,Repair of shoulder joint capsule using an endoscope
29807,Repair of shoulder socket using an endoscope
29819,Removal of loose or foreign body in shoulder joint using an endoscope
29820,Partial removal of shoulder joint lining using an endoscope
29821,Removal of entire shoulder joint lining using an endoscope
29822,Limited removal of abnormal shoulder joint tissue using endoscope
29823,Removal of extensive shoulder joint tissue using an endoscope
29824,Partial removal of collar bone at shoulder using an endoscope
29825,Removal of shoulder scar tissue using an endoscope
29826,Shaving of part of shoulder bone and repair of ligament using an endoscope
29827,Repair of shoulder rotator cuff using an endoscope
29828,Release of tendon connecting biceps muscle and shoulder using an endoscope
29830,Diagnostic exam of elbow joint using an endoscope
29834,Removal of loose or foreign body in elbow joint using an endoscope
29835,Partial removal of elbow joint lining using an endoscope
29836,Removal of entire elbow joint lining using an endoscope
29837,Removal of elbow joint tissue using an endoscope
29838,Removal of extensive damaged tissue from elbow joint using an endoscope
29840,Diagnostic exam of wrist using an endoscope
29844,Partial removal of wrist joint lining using an endoscope
29845,Removal of entire wrist joint lining using an endoscope
29846,Removal or repair of wrist cartilage using an endoscope
29847,Placement of internal stabilizing device using an endoscope to treat broken or unstable wrist
29848,Release of wrist ligament using an endoscope
29850,Treatment of broken knee joint using an endoscope
29851,Treatment of broken knee joint with placement of stabilizing device using an endoscope
29855,Treatment of broken upper portion of lower leg bone on side using an endoscope
29856,Treatment of broken upper portion of lower leg bone on both sides using an endoscope
29860,Diagnostic exam of hip using an endoscope
29861,Removal of loose or foreign body in hip joint using an endoscope
29862,Removal or shaving of hip joint socket cartilage using an endoscope
29863,Removal of hip joint lining using an endoscope
29867,Repair of knee cartilage and bone with donor cartilage graft using an endoscope
29870,Diagnostic exam of knee using an endoscope
29871,"Exam, washing, and drainage of infected knee joint using an endoscope"
29873,Release of ligaments at outer side of knee joint using an endoscope
29874,Removal of loose or foreign body in knee joint using an endoscope
29875,Partial removal of knee joint lining using an endoscope
29876,Removal of joint lining from multiple knee joint compartments using an endoscope
29877,Removal or shaving of knee joint cartilage using an endoscope
29879,Repair of knee joint with drilling and or scraping of joint using an endoscope
29880,Removal of both knee cartilages using an endoscope
29881,Removal of knee cartilage using an endoscope
29882,Repair of inside or outside knee joint cartilage using an endoscope
29883,Repair of inside and outside knee joint cartilage using an endoscope
29884,Removal of scar tissue from knee using an endoscope
29885,Repair of knee joint with bone graft using an endoscope
29886,Repair of knee joint by drilling cartilage using an endoscope
29887,Repair of knee joint with bone graft and internal stabilizing device using an endoscope
29888,Repair of anterior cruciate ligament of knee using an endoscope
29889,Repair of posterior cruciate ligament of knee using an endoscope
29891,Removal of shin and/or ankle bone defect using an endoscope
29892,Removal of large shin or ankle bone defect using an endoscope
29893,Repair of fibrous tissue of arch of foot using an endoscope
29894,Removal of loose or foreign body in ankle using an endoscope
29895,Partial removal of ankle joint lining using an endoscope
29897,Removal of limited dead or infected tissue using an endoscope
29898,Removal of extensive dead or infected tissue using an endoscope
29899,Fusion of ankle joint using an endoscope
29901,Removal of dead or infected finger joint tissue using an endoscope
29904,Removal of loose or foreign body in ankle joint at heel bones using an endoscope
29905,Removal of lining of ankle joint using an endoscope
29906,Removal of dead or infected ankle joint tissue using an endoscope
29907,Fusion of foot joint using an endoscope
29914,Reshaping of thigh bone at hip joint using an endoscope
29915,Reshaping of hip socket using an endoscope
29916,Repair of hip joint socket cartilage using an endoscope
29999,Other procedure on joint using an endoscope
30000,Drainage of abscess or blood accumulation of nose
30020,Drainage of abscess or blood accumulation of nasal cartilage
30100,Biopsy of lining of nose
30110,Simple removal of nasal polyp
30115,Extensive removal of nasal polyp
30117,Removal or destruction of growth of nose through nose
30118,Removal or destruction of growth of nose
30120,Removal or scraping of skin on nose
30124,Simple removal of cyst and skin growth of nose
30125,Removal of growth under nasal bone or cartilage
30130,Removal of nasal air passage
30140,Removal of nasal air passage under lining tissue
30150,Partial removal of nose
30160,Removal of nose
30200,Injection of medication into nasal air passage
30210,Irrigation and drainage of sinus
30220,Insertion of implant to close nasal passage
30300,Removal of foreign body in nose
30310,Removal of foreign body in nose under anesthesia
30400,Reshaping of tip of nose
30410,"Reshaping of bone, cartilage, and/or tip of nose"
30420,Reshaping of bony cartilage dividing nasal passages
30430,Revision to reshape nose or small amount of tip of nose after previous repair
30435,Revision to reshape nasal bones after previous repair
30450,Revision to reshape nasal bones and tip of nose after previous repair
30462,Revision of congenital nasal defect with lengthening of tip of nose
30465,Repair of nasal passage
30468,Repair of collapsed nostril using implant in side of nose
30469,Repair of collapsed nasal valve
30520,Reshaping of nasal cartilage
30560,Release of nasal scar tissue
30580,Repair of abnormal drainage tract between nasal sinuses
30600,Repair of abnormal drainage tract between mouth and nasal cavity
30620,Reconstruction of lining of nasal passage with graft
30630,Repair of openings of nasal cartilage
30801,Destruction of soft tissue of nasal passages
30802,Destruction of surface soft tissue of nasal passages
30901,Simple control of nose bleed
30903,Complex control of nose bleed
30905,Initial control of nose bleed and insertion of packing
30906,Subsequent control of nosebleed and insertion of packing
30915,Tying of ethmoidal artery ethmoidal for control of nose bleed
30920,Tying of internal nasal artery for control of nose bleed
30930,Therapeutic fracture of nasal passages
30999,Other procedure on nose
31000,Irrigation of nasal sinus
31002,Irrigation of sphenoid nasal sinus
31020,Incision of nasal sinus through nose
31030,Creation of window into nasal sinus
31032,Removal of nasal sinus polyp
31040,Incision through sinus at cheek bone to reach nerve and blood vessel
31050,Incision of sphenoid nasal sinus
31051,Removal of nasal polyps
31070,Simple incision of frontal nasal sinus
31081,Insertion of material to stop growth of nasal sinus lining through forehead
31085,Insertion of material to stop growth of nasal sinus lining with bone flap through forehead
31087,Incision of forehead and placement of bone flap to drain frontal nasal sinus
31090,Removal of tissue or growths in 3 or more nasal sinuses on side of face
31200,Partial removal of nasal sinus
31201,Removal of nasal sinus from within nasal passage
31205,Removal of nasal sinus from outside nasal passage
31225,Removal of nasal sinus
31230,Removal of nasal sinus and eye bone
31231,Diagnostic exam of nasal passages using an endoscope
31233,Exam of nasal passage and sinus using an endoscope
31235,Exam of nasal passage and sphenoid sinus using an endoscope
31237,Biopsy or removal of nasal polyp or tissue using an endoscope
31238,Control of bleeding of nose using an endoscope
31239,Incision of tear duct using an endoscope
31240,Removal of nasal breathing passages using an endoscope
31241,Tying of sphenopalatine artery using an endoscope
31253,Complete exam of nose and sinuses using an endoscope
31254,Partial removal of nasal sinus using an endoscope
31255,Removal of nasal sinus using an endoscope
31256,Incision of nasal sinus using an endoscope
31257,Exam of nose and sinus with removal of nasal sinus using an endoscope
31259,Removal of tissue from sphenoid sinus using an endoscope
31267,Removal of nasal sinus tissue using an endoscope
31276,Exploration of nasal sinus using an endoscope
31287,Incision of sphenoid nasal sinus using an endoscope
31288,Removal of sphenoid nasal sinus tissue using an endoscope
31290,Repair of leak of brain and spinal fluid from sinus behind bridge of nose using endoscope
31291,Repair of leak of brain and spinal fluid from sinus behind eyes using endoscope
31292,Decompression of medial or inferior wall of eye socket using an endoscope
31293,Decompression of medial and inferior wall of eye socket using an endoscope
31294,Decompression of optic nerve using an endoscope
31295,Dilation of nasal sinus using an endoscope
31296,Dilation of frontal nasal sinus using an endoscope
31297,Dilation of sphenoid nasal sinus using an endoscope
31298,Dilation of sphenoid and frontal nasal sinus using an endoscope
31299,Other procedure on accessory sinuses
31300,Removal of vocal cord growth or cartilage attachment
31360,Complete removal of voice box
31365,Complete removal of voice box with extensive dissection of neck
31367,Removal of voice box
31370,Partial removal of voice box
31375,Partial removal of voice box through front and side of neck
31380,Partial removal of voice box and adjoining tissue
31382,Partial removal of voice box and cartilage
31390,"Removal of voice box, throat, muscle, lymph nodes, and glands"
31395,"Removal of voice box and throat, muscle, lymph nodes, and glands with reconstruction of defect"
31400,Removal or repair of voice box cartilage
31420,Removal of cartilage attaching tongue
31500,Emergent insertion of breathing tube into windpipe using an endoscope
31502,Change of breathing tube in windpipe
31505,Diagnostic exam of voice box using an endoscope with mirror
31510,Biopsy of voice box using an endoscope with mirror
31511,Removal of foreign body in voice box using an endoscope with mirror
31513,Injection of vocal cord using an endoscope with mirror
31515,Aspiration of voice box using an endoscope
31525,Diagnostic exam of voice box using an endoscope
31526,Diagnostic exam of voice box using an endoscope with operating microscope or telescope
31527,Insertion of device to close opening of voice box using an endoscope
31528,Initial dilation of voice box using an endoscope
31529,Subsequent dilation of voice box using an endoscope
31530,Removal of foreign body in voice box using an endoscope
31531,Removal of foreign body in voice box using an endoscope with operating microscope or telescope
31535,Biopsy of voice box using an endoscope
31536,Biopsy of voice box using an endoscope with operating microscope or telescope
31540,Removal of growth of throat and/or stripping of vocal cords using an endoscope
31541,Removal of growth of tongue and/or stripping of vocal cord using an endoscope with operating microscope or telescope
31545,Removal of vocal cord growths and reconstruction with local tissue flap using an endoscope with operating microscope or telescope
31546,Removal of vocal cord growths and reconstruction with graft using an endoscope with operating microscope or telescope
31552,Repair of narrowed voice box with graft (12 years or older)
31554,Repair of narrowed voice box with graft and placement of indwelling stent (12 years or older)
31560,Removal of voice box cartilage using an endoscope
31561,Removal of voice box cartilage using an endoscope with operating microscope or telescope
31570,Injection into vocal cords using an endoscope
31571,Injection into vocal cords using an endoscope with operating microscope or telescope
31572,Removal or destruction of growth of side of voice box using an endoscope
31573,Injection of drug into side of voice box using an endoscope
31574,Injection of substance to augment voice box using an endoscope
31575,Diagnostic exam of voice box using a flexible endoscope
31576,Biopsy of voice box using a flexible endoscope
31577,Removal of foreign body in voice box using a flexible endoscope
31578,Removal of growth of voice box using an endoscope
31579,Exam to assess movement of vocal cord flaps using an endoscope
31580,Repair of congenital vocal cord defect with insertion of indwelling stent
31584,Incision of voice box to repair fracture
31591,Repair of side of voice box by moving vocal cord to middle
31592,Partial removal of windpipe and cartilage
31599,Other procedure on voice box
31600,Incision of windpipe for insertion of breathing tube (older than 2 years)
31603,Emergent incision of windpipe through neck for insertion of breathing tube
31605,Emergent incision of windpipe for insertion of breathing tube
31610,Creation of permanent opening of windpipe for breathing
31611,Creation of opening of windpipe and insertion of speech prosthesis
31612,Puncture of windpipe for aspiration and/or injection
31613,Simple revision of permanent opening of windpipe for breathing
31614,Revision of permanent opening of windpipe for breathing with flap rotation
31615,Exam of windpipe and lung airways through permanent windpipe opening using an endoscope
31622,Diagnostic exam of lung airway using an endoscope
31623,Exam of lung airways using an endoscope
31624,Irrigation and suction of lung airways to obtain cells using an endoscope
31625,Biopsy of lung airway using an endoscope
31626,Placement of radiation therapy markers into lung airways using an endoscope
31627,Computer-assisted image-guided navigation of lung airways using an endoscope
31628,"Biopsy of lobe of lung using an endoscope, 1 lobe"
31629,"Needle biopsy of windpipe cartilage, airway, and/or lung using an endoscope"
31630,Dilation of windpipe cartilage or treatment of broken windpipe cartilage using an endoscope
31631,Placement of stent into windpipe using an endoscope
31632,"Biopsy of lobe of lung using an endoscope, each additional lobe"
31633,"Needle biopsy of lobe of lung using an endoscope, each additional lobe"
31634,Exam of lung airways with repair of air leak using an endoscope
31635,Removal of foreign body in lung airways using an endoscope
31636,"Placement of stent in lung airway using an endoscope, first stent"
31637,"Placement of stent in lung airway using an endoscope, each additional stent"
31638,Revision of previously inserted lung airway stent using an endoscope
31640,Removal of growth of lung airways using an endoscope
31641,Destruction of growth or narrowing of lung airway using an endoscope
31643,Placement of tube for radiation delivery in lung airway using an endoscope
31645,Aspiration of initial secretion of lung airway using an endoscope
31646,Aspiration of subsequent secretions of lung airway using an endoscope during same hospital stay
31647,Assessment of initial lobe of lung for air leak and airway sizing with insertion of bronchial valve in lung airway using an endoscope
31648,"Removal of bronchial valves of lung airways of lobe of lung using an endoscope, initial lobe"
31649,"Removal of bronchial valves of lung airways of lobe of lung using an endoscope, each additional lobe"
31651,"Assessment of air leak and airway sizing with insertion of bronchial valve in lung airway using an endoscope, each additional lobe"
31652,"Exam of lung airways and sampling of lymph nodes using an endoscope and ultrasound guidance, 1-2 lymph nodes"
31653,"Exam of lung airways and sampling of lymph nodes using an endoscope and ultrasound guidance, 3 or more lymph nodes"
31654,Exam of lung airways with diagnostic or therapeutic procedure on growths using an endoscope and ultrasound
31660,Thermal repair of airways of lobe of lung using an endoscope
31661,Thermal repair of airways of multiple lobes of lung using an endoscope
31717,Insertion of tube into airway of lung for biopsy
31720,Insertion of tube into airway for aspiration of secretions
31725,Insertion of tube into windpipe and airways of lung for aspiration of secretions using an endoscope at bedside
31730,Insertion of needle wire dilator or indwelling tube for oxygen therapy
31750,Repair of windpipe cartilage through neck
31760,Repair of windpipe cartilage through chest
31770,Repair of lung airway with graft
31780,Removal of narrowed area of windpipe in neck with suture repair
31781,Removal of narrowed area of windpipe in neck and chest with suture repair
31785,Removal of growth of windpipe cartilage
31800,Suture of injury of windpipe in neck
31820,Closure of permanent windpipe opening or abnormal drainage tract
31825,Closure of permanent windpipe opening or abnormal drainage tract with plastic repair
31830,Revision of permanent windpipe opening scar
31899,Other procedure on windpipe or lung airway
32035,Removal of rib with creation of tract for drainage of infected material
32036,Creation of open flap tract for drainage of infected material from lining around lung
32096,Biopsy of fluid collection of lung
32097,Biopsy of growth of lung
32098,Biopsy of lung lining
32100,Incision and exploration of chest cavity
32110,Repair of tear of lung and/or control of traumatic bleeding through chest
32120,Incision of chest cavity for complications after surgery
32124,Release of lung lining through chest
32141,Removal of air sac of lung through chest
32150,Removal of foreign body or clot in lining of lung through chest
32151,Removal of foreign body in lung
32160,Massage of heart muscle through chest
32200,Drainage of abscess or cyst of infected lung
32215,Creation of scarring on surface of lung
32220,Removal of lining of lung for lung expansion
32225,Partial removal of lining of lung for lung expansion
32310,Removal of lining of chest cavity
32320,Removal of lining of chest cavity and lining of lung
32400,Needle biopsy of lining of lung
32408,"Core needle biopsy of lung or center cavity of chest (mediastinum), accessed through skin"
32440,Removal of lung
32445,Removal of lung and lining of chest cavity
32480,Removal of lobe of lung
32482,Removal of 2 lobes of lung
32484,Removal of segment of lung tissue
32486,Removal of portion of lung and segment of lung airway
32488,Removal of remaining lung after previous partial removal of lung
32501,Repair of lung airway and removal of segment of lung
32503,Removal of growth of lung
32504,Removal of growth of lung and reconstruction of chest wall
32505,Initial removal of wedge of lung tissue
32506,"Removal of lung tissue wedge through chest, each additional removal"
32507,Removal of lung tissue wedge for diagnosis
32540,Removal of infected material between lung and chest wall
32550,Insertion of indwelling tube for drainage of lung fluid
32551,Removal of fluid from between lung and chest cavity
32552,Removal of indwelling tube in lining of lung
32553,Insertion of device in chest cavity for radiation therapy guidance
32554,Aspiration of fluid from chest cavity
32555,Aspiration of fluid from chest cavity using imaging guidance
32556,Drainage of fluid from chest cavity with insertion of indwelling tube
32557,Drainage of fluid from chest cavity with insertion of indwelling tube using imaging guidance
32560,Instillation of agent onto lung surface using chest tube
32561,Initial instillation of agent onto lung lining using chest tube
32562,Subsequent instillation of agent onto lung lining using chest tube
32601,"Diagnostic exam of lungs, heart sac, chest cavity, or lung lining using an endoscope"
32604,Biopsy of heart sac using an endoscope
32606,Biopsy of tissue of chest using an endoscope
32607,Biopsy of fluid collection of lung using an endoscope
32608,Biopsy of growth of lung using an endoscope
32609,Biopsy of lung lining using an endoscope
32650,Adhesion of linings of lung using an endoscope
32651,Partial removal of chest cavity lining and lung lining using an endoscope
32652,Removal of chest cavity lining and lung lining using an endoscope
32653,Removal of foreign body in lining of chest cavity using an endoscope
32654,Control of traumatic bleeding in chest using an endoscope
32655,Removal of air sac of lung using an endoscope
32656,Removal of lining of lung using an endoscope
32658,Removal of blood clot or foreign body in heart sac using an endoscope
32659,Creation of opening or partial removal of heart sac using an endoscope
32661,Removal of cyst or growth of heart sac using an endoscope
32662,Removal of cyst or growth of chest cavity using an endoscope
32663,Exam of lung with removal of lung lobe using an endoscope
32664,Removal of nerves to chest cavity using an endoscope
32665,Repair of esophagus using an endoscope
32666,Initial removal of wedge of lung tissue using an endoscope
32667,"Removal of wedge of tissue of lung using an endoscope, each additional removal"
32668,Biopsy of wedge of lung tissue followed by partial removal of lung
32669,Removal of segment of lung tissue using an endoscope
32670,Removal of 2 lobes of lung using an endoscope
32671,Removal of lung using an endoscope
32672,Partial removal of lung to reduce lung volume using an endoscope
32673,Removal of thymus gland using an endoscope
32674,Removal of lymph nodes of chest cavity using an endoscope
32701,Delineation of thoracic targets for radiation therapy
32800,Repair of lung hernia through chest wall
32810,Closure of chest wall after drainage of infected lung
32815,Closure of abnormal drainage tract from chest cavity to lung airway
32820,Reconstruction of chest wall after injury
32851,Transplantation of lung
32852,Transplantation of lung on heart-lung machine
32853,Transplantation of 2 lungs
32854,Transplantation of 2 lungs on heart-lung machine
32855,Preparation of donor lung
32856,Preparation of 2 donor lungs
32900,Removal of ribs
32906,Removal of infected area of chest cavity and closure of abnormal drainage tract
32940,Release of lining covering lung from chest wall
32994,Destruction of growth of lung using extreme cold
32997,Irrigation and drainage of lung
32998,Destruction of growth of lung using radiofrequency
32999,Other procedure on lung and lung lining
33016,Drainage of heart sac using imaging guidance
33017,Drainage of heart sac using tube and imaging guidance (6 years or older)
33019,Drainage of heart sac using tube and ct imaging guidance
33020,Removal of blood clot or foreign body in heart sac
33025,Surgical removal of piece of sac covering heart for drainage
33030,Removal of heart sac
33031,Removal of heart sac on heart-lung machine
33050,Removal of growth or cyst of from heart sac
33120,Removal of growth of heart on heart-lung machine
33130,Removal of growth on outside of heart
