code,description
57550,Removal of remaining cervix through vagina
57720,Plastic repair of cervix
57800,Dilation of cervical canal
58100,Biopsy of lining of uterus
58110,Exam of cervix using an endoscope with biopsy of lining of uterus
58120,Dilation and scraping of uterus
58140,"Removal of growth of uterus through abdomen, 1-4 growths"
58145,"Removal of growth of uterus through vagina, 1-4 growths"
58146,Removal of 5 or more growths of uterus through abdomen
58150,Removal of uterus and cervix through abdomen
58152,Removal of uterus and cervix through abdomen with repair of vagina
58180,Removal of uterus through abdomen
58200,Removal of uterus through abdomen with partial removal of vagina
58210,"Removal of uterus, cervix, and lymph nodes of pelvis with biopsy of lymph nodes of aorta"
58240,"Removal of malignant uterus, cervix, lymph nodes, and bladder with transplant of ureters and bowel"
58260,"Removal of uterus through vagina, 250.0 g or less"
58262,"Removal of uterus, tubes, and/or ovaries through vagina, 250.0 g or less"
58263,"Removal of uterus, tubes, and/or ovaries with repair of herniated bowel through vagina, 250.0 g or less"
58267,"Removal of uterus with repair for incontinence, 250.0 g or less"
58270,"Removal of uterus with repair of herniated bowel through vagina, 250.0 g or less"
58275,Removal of uterus and vagina
58280,Removal of uterus and vagina with repair of herniated bowel into rectum or vagina through vagina
58290,"Removal of uterus through vagina, more than 250.0 g"
58291,"Removal of uterus, tubes, and/or ovaries through vagina, more than 250.0 g"
58301,Removal of iud
58340,Insertion of tube and introduction of contrast for x-ray of uterus and fallopian tubes
58350,Injection of x-ray contrast into fallopian tube
58353,Destruction of lining of uterus
58400,Repositioning of uterus
58541,"Partial removal of uterus with retention of cervix using an endoscope, 250.0 g or less"
58542,"Partial removal of uterus, tubes, and/or ovaries with retention of cervix using an endoscope, 250.0 g or less"
58543,"Partial removal of uterus with retention of cervix using an endoscope, more than 250.0 g"
58544,"Partial removal of uterus, tubes, and/or ovaries with retention of cervix using an endoscope, more than 250.0 g"
58545,"Removal of growth of uterus using an endoscope, 250.0 g or less"
58546,"Removal of growth of uterus using an endoscope, more than 250.0 g"
58548,"Removal of uterus, cervix, and lymph nodes of pelvis with biopsy of aortic lymph node using an endoscope"
58550,"Removal of uterus through vagina using an endoscope, 250.0 g or less"
58552,"Removal of uterus, tubes, and/or ovaries through vagina using an endoscope, 250.0 g or less"
58553,"Removal of uterus through vagina using an endoscope, more than 250.0"
58554,"Removal of uterus, tubes, and/or ovaries through vagina using an endoscope, more than 250.0 g"
58555,Diagnostic exam of uterus using an endoscope
58558,Biopsy of lining of uterus and/or removal of polyp using an endoscope
58559,Release of scar tissue of uterus using an endoscope
58560,Release of scar tissue of uterus and release or removal and septum using an endoscope
58561,Removal of growth of muscle of uterus using an endoscope
58562,Removal of foreign body in uterus using an endoscope
58563,Exam of uterus with destruction of lining of uterus using an endoscope
58570,"Removal of uterus through abdomen using an endoscope, 250.0 g or less"
58571,"Removal of uterus, tubes, and/or ovaries through abdomen using an endoscope, 250.0 g or less"
58572,"Removal of uterus through abdomen using an endoscope, more than 250.0 g"
58573,"Removal of uterus, tubes, and/or ovaries through abdomen using an endoscope, more than 250.0 g"
58575,Removal of uterus for removal of growth using an endoscope
58578,Other procedure on uterus using an endoscope
58611,Tying or incision of fallopian tubes during cesarean delivery or other abdominal surgery
58660,Removal of scar tissue of ovaries or fallopian tubes using an endoscope
58661,Removal of ovaries and/or tubes using an endoscope
58662,Destruction or removal of ovary or growth of pelvis using an endoscope
58670,Destruction of fallopian tubes using an endoscope
58674,Destruction of growth of uterus using an endoscope with ultrasound guidance and monitoring
58679,Other procedure on fallopian tube or ovary using an endoscope
58700,Removal of uterine tubes
58720,Removal of uterine tubes and ovaries
58740,Removal of scar tissue of ovaries or fallopian tubes
58805,Drainage of cysts of ovaries through abdomen
58925,Removal of cysts of ovaries
58940,Removal of ovaries
58943,Removal of ovaries for ovarian cancer
58950,"Removal of lining of abdomen, ovaries, and fallopian tubes"
58951,"Removal of lining of abdomen, uterus, ovaries, fallopian tubes, and lymph nodes of pelvis and aorta"
58952,"Removal of lining of abdomen, ovaries, and fallopian tubes with reduction of growth"
58953,"Removal of lining of abdomen, uterus, ovaries, and fallopian tubes with extensive reduction of growth"
58954,"Removal of lining of abdomen, uterus, ovaries, fallopian tubes, and lymph nodes of pelvis and aorta for reduction of growth"
58956,"Removal of lining of abdomen, uterus, ovaries, and fallopian tubes"
58957,"Removal of uterus, ovaries, fallopian tubes, and lymph nodes for reduction of growth"
58958,"Removal of uterus, ovaries, fallopian tubes, and lymph nodes for reduction of growth with lymph node dissection"
58960,Exam of abdominal cavity with removal or biopsy of abdominal lining or lymph nodes
58999,Other procedure on female genital system (nonobstetrical)
59000,Removal of sample of amniotic fluid surrounding fetus for diagnosis
59025,Fetal test
59151,Removal of ovarian or tubal pregnancy with removal of ovary and/or tube using an endoscope
59160,Scraping of lining of uterus after delivery
59200,Insertion of dilator device into cervix
59300,Episiotomy or repair of vagina
59320,Suture of cervix during pregnancy through vagina
59400,Vaginal delivery with care before and after delivery
59409,Vaginal delivery
59410,Vaginal delivery with post delivery care
59412,Turning of fetus through external manipulation
59414,Delivery of placenta
59425,"Predelivery care, 4 to 6 visits"
59426,"Predelivery care, 7 or more visits"
59430,Post delivery care
59510,Cesarean delivery with care before and after delivery
59514,Cesarean delivery
59515,Cesarean delivery with care after delivery
59610,Vaginal delivery and care before and after delivery after previous cesarean delivery
59612,Vaginal delivery after previous cesarean delivery
59614,Vaginal delivery and care after delivery after prior cesarean delivery
59618,Cesarean delivery and care before and after delivery following attempted vaginal delivery after previous cesarean delivery
59620,Cesarean delivery following vaginal delivery attempt after previous cesarean delivery
59812,Treatment of miscarriage
59820,Treatment of miscarriage during first trimester
59821,Treatment of miscarriage during second trimester
59841,Induced abortion by dilation
59871,Removal of suture of cervix under anesthesia
60100,Needle biopsy of thyroid through skin
60200,Incision of cyst or growth of thyroid
60210,Partial removal of thyroid lobe on side of neck
60212,Partial removal of thyroid lobes on both sides of neck and connecting tissue
60220,Removal of thyroid lobe on side of neck
60225,Removal of thyroid lobe on side of neck and partial removal of thyroid lobe on opposite side of neck including tissue in between
60240,Removal of thyroid
60252,Removal of thyroid and surrounding lymph nodes with limited neck removal
60254,Removal of thyroid and surrounding lymph nodes with extensive neck removal
60260,Removal of remaining thyroid tissue from prior operation
60270,Removal of thyroid from under breastbone
60271,Removal of thyroid through chest or back
60280,Removal of cyst of thyroid or drainage of thyroid gland duct
60300,Aspiration and/or injection of cyst of thyroid
60500,Removal or exploration of parathyroid glands
60502,Removal or re-exploration of parathyroid glands
60505,Removal or exploration of parathyroid glands and breast bone tissue
60512,Removal and reimplantation of parathyroid tissue
60520,Removal of thymus gland through neck
60521,Removal of thymus gland through sternum or chest
60522,Removal of thymus gland surrounding lymph nodes through sternum or chest
60540,Removal or exploration of adrenal gland through abdomen
60545,Removal or exploration of adrenal gland through abdomen with removal of growth abdomen
60600,Removal of growth of carotid artery
60605,Removal of carotid artery and growth
60650,Removal or exploration of adrenal gland through abdomen using an endoscope
60659,Other procedure on endocrine system using an endoscope
60699,Other procedure on endocrine system
61020,Removal of cerebrospinal fluid from brain for diagnosis
61026,Removal of cerebrospinal fluid from brain and injection of substance
61050,Removal of cerebrospinal fluid from upper spine
61055,Spinal puncture in upper spine with injection of substance
61070,Aspiration of cerebrospinal fluid and injection in shunt tubing or reservoir
61105,Creation of opening in skull for removal of fluid from brain
61107,Creation of opening in skull for insertion of brain tube or monitoring device
61108,Creation of opening in skull for removal and/or drainage of blood accumulation outside brain
61120,Burr hole for injection into ventricle of brain
61140,Burr hole with drainage or biopsy of brain or growth
61150,Burr hole with drainage of abscess or cyst of brain
61154,Burr hole with removal and/or drainage of blood accumulation outside or below brain membrane
61156,Burr hole with aspiration of blood accumulation or cyst of brain
61210,Burr hole for insertion of brain tube or monitoring device
61215,Insertion of device for continuous infusion in brain
61304,Removal of skull bone for exploration of upper brain
61305,Removal of skull bone for exploration of lower brain
61312,Removal of skull bone for aspiration of blood accumulation in upper brain outside or below brain membrane
61313,Removal of skull bone for aspiration of blood accumulation in upper brain
61314,Removal of skull bone for aspiration of blood accumulation in lower brain outside or below brain membrane
61315,Removal of skull bone for aspiration of blood accumulation in lower brain
61316,Placement of bone graft in skull
61320,Removal of skull bone for drainage of upper brain abscess
61321,Removal of skull bone for drainage of lower brain abscess
61322,Removal of skull bone to reduce brain pressure
61323,Removal of skull bone and brain lobe to reduce brain pressure
61330,Incision of eye bone to reduce pressure
61333,Exploration and removal of bone growth of eye socket
61343,Removal of skull base bone and upper spine bone to release spinal cord
61345,Removal of base of skull to reduce pressure on brain
61450,Removal of skull bone to reduce facial nerve pressure
61458,Removal of skull base bone for exploration or release of cranial nerves
61460,Removal of skull base bone to sever cranial nerve
61500,Removal of growth of brain or other growth of skull bone
61501,Removal of infected skull bone
61510,Removal of skull bone for removal of growth of upper brain
61512,Removal of skull bone for removal of growth of upper brain membrane
61514,Removal of skull bone for removal of upper brain abscess
61516,Removal of skull bone for removal or drainage of cyst of upper brain
61517,Implantation of chemotherapy agent into brain
61518,Removal of skull bone for removal of growth of lower brain
61519,Removal of skull bone for removal of growth of lower brain membrane
61520,Removal of skull bone for removal of eighth cranial nerve brain growth
61521,Removal of skull bone for removal of skull base bone growth
61522,Removal of skull bone for removal of brain abscess
61524,Removal of skull bone for removal or drainage of cyst of brain
61526,Removal of skull bone with bone flap for removal of eighth cranial nerve brain tumor
61533,Removal of skull bone for insertion of brain electrode for seizure monitoring
61535,Removal of skull bone for removal of electrode from brain
61536,Removal of skull bone for removal of brain tissue to stop seizures with monitoring
61537,Removal of skull bone for removal of brain lobe
61538,Removal of skull bone for removal of brain lobe with monitoring
61545,Removal of skull bone with bone flap for removal of growth of pituitary gland
61546,Removal of skull bone for removal of growth of pituitary gland
61548,Removal of growth of pituitary gland
61570,Removal of foreign body in brain
61571,Treatment of penetrating brain wound
61575,"Biopsy, release of pressure, or removal of growth of brain stem of upper spinal cord"
61580,Removal of nasal sinuses to approach growth of brain
61581,Removal of nasal sinuses to approach growth of brain with the removal of the maxilla or eyeball
61582,Removal of facial bone to approach growth of brain outside brain membrane
61583,Removal of facial bone to approach growth of brain within brain membrane
61584,Removal of facial bone to approach growth of brain without orbital exenteration
61585,Removal of facial bone and eyeball to approach growth of brain
61586,Removal of facial bone to approach growth of brain without bone graft
61590,Removal of jaw bone to approach growth of brain
61591,Removal of skull bone behind ear to approach growth of brain
61592,Removal of cheek bone and skull to approach growth of brain
61595,Removal of skull bone behind ear to approach growth of brain through the temporal lobe
61596,Removal of skull bone behind ear to approach growth of brain through the ear
61597,Removal of base skull bone to approach growth of brain
61598,Removal of skull bone to approach growth of brain or defect at skull base with tying of sinus
61600,Removal of growth or tissue of front of skull base outside membranes covering brain
61601,Removal of growth or tissue of front of skull base within membranes covering brain
61605,Removal of growth or tissue of lower skull base outside brain membrane
61606,Removal of growth or tissue of lower skull base within brain membrane
61607,Removal of growth or tissue of middle skull base outside brain membrane
61608,Removal of growth or tissue of middle skull base within brain membrane
61615,Removal of growth or tissue of skull base outside brain membrane
61616,Removal of growth or tissue of skull base within brain membrane
61618,Repair of brain covering by tissue or synthetic graft
61619,Repair of brain covering by vascular or combined vascular muscle graft
61623,Balloon occlusion of head or neck artery with review by radiologist
61624,Occlusion of central nervous system or spinal cord artery
61626,Occlusion of head or neck artery
61630,Balloon dilation of blood vessel in head
61635,Insertion of stent in blood vessel of head
61645,Removal of blood clot and injection to dissolve blood clot from head artery using fluoroscopic guidance
61650,"Infusion of chemical agent into artery of brain with insertion of tube and imaging, initial territory"
61651,"Infusion of chemical agent into artery of brain with insertion of tube and imaging, each additional territory"
61680,Simple repair of abnormal artery-vein connection in upper brain
61682,Complex repair of abnormal artery-vein connection in upper brain
61684,Simple repair of abnormal artery-vein connection in lower brain
61686,Complex repair of abnormal artery-vein connection in lower brain
61690,Simple repair of abnormal artery-vein connection in membrane covering brain
61692,Complex repair of abnormal artery-vein connection in membrane covering brain
61697,Repair of complex aneurysm of neck artery
61698,Repair of complex aneurysm of back of brain artery
61700,Repair of simple aneurysm of neck artery
61711,Connection of arteries of head
61735,Computer-assisted creation of growth of brain of deep brain structure
61736,"Laser interstitial thermal therapy (litt) of single, simple growth within skull"
61737,Laser interstitial thermal therapy (litt) of multiple or complex growth within skull
61750,"Computer-assisted biopsy, aspiration, or excision of growth of brain"
61751,"Computer-assisted biopsy, aspiration, or excision of growth of brain using ct and/or mri guidance"
61760,Computer-assisted implantation of brain electrodes for seizure monitoring
61781,Computer-assisted procedure inside brain
61782,Computer-assisted procedure outside membrane covering brain
61783,Computer-assisted spinal procedure
61790,Computer-assisted creation of growth of face nerve
61791,Computer-assisted creation of growth of brainstem
61796,"Computer-assisted radiosurgery of simple growth of brain, first growth"
61797,"Computer-assisted radiosurgery of simple growth of brain, each additional growth"
61798,"Computer-assisted radiosurgery of complex growth of brain, first growth"
61799,"Computer-assisted radiosurgery of complex growth of brain, each additional growth"
61800,Computer-assisted radiosurgery application of headframe
61850,Creation of opening in skull for insertion of neurostimulator electrodes in brain
61860,Removal of skull bone for insertion of neurostimulator electrodes in brain
61863,"Removal of skull bone with computer-assisted insertion of neurostimulator electrodes in brain, first array"
61864,"Removal of skull bone with computer-assisted insertion of neurostimulator electrodes in brain, each additional array"
61867,"Removal of skull bone with computer-assisted insertion of neurostimulator electrodes in brain with recording, first array"
61868,"Removal of skull bone with computer-assisted insertion of neurostimulator electrodes in brain with recording, each additional array"
61880,Revision or removal of brain neurostimulator electrodes
61885,Insertion of brain neurostimulator pulse device with connection to single electrode array
61886,Insertion of brain neurostimulator pulse device with connection to 2 or more electrode arrays
61888,Removal of brain neurostimulator device
62005,Elevation of complicated depressed broken skull bone
62010,Elevation of depressed broken skull bone with repair of brain
62100,Removal of skull bone for repair of cerebrospinal fluid leak
62120,Repair of herniated brain and reconstruction of skull bone
62121,Removal of skull bone for repair of herniated brain at skull base
62140,"Repair of skull bone defect, 5 cm or less"
62141,"Repair of skull bone defect, more than 5.0 cm"
62142,Removal of skull bone flap or skull plate
62143,Replacement of skull bone flap or skull plate
62145,Repair of skull bone defect and brain
62146,"Repair of skull bone with graft, 5.0 cm or less"
62147,"Repair of skull bone with graft, more than 5.0 cm"
62148,Incision and retrieval of skull bone for graft
62160,Insertion of tube in brain using an endoscope
62161,Removal of brain scar tissue or drainage of cyst and insertion or removal tube in brain using an endoscope
62162,Drainage of cyst of brain and insertion of tube in brain using an endoscope
62164,Removal of growth of brain and insertion of tube in brain using an endoscope
62165,Removal of growth of pituitary using an endoscope
62192,"Creation of brain fluid drainage shunt, sub-peritoneal, -pleural, other terminus"
62194,Replacement or irrigation of tube in membranes covering brain
62200,Creation of spinal fluid drainage tract in third ventricle of brain
62201,Computer-assisted creation of cerebrospinal fluid drainage tract in third ventricle of brain
62220,"Creation of brain fluid drainage shunt, ventriculo-atrial, -jugular, -auricular"
62223,"Creation of brain fluid drainage shunt, ventriculo-peritoneal, -pleural, other terminus"
62225,Replacement or irrigation of tube in brain
62230,Insertion or revision of cerebrospinal fluid drainage shunt valve or tube
62252,Reprogramming of cerebrospinal fluid shunt
62256,Removal of cerebrospinal fluid shunt system
62258,Removal and insertion of cerebrospinal fluid shunt system
62263,"Removal of spinal canal scar tissue, multiple sessions over 2 days or more"
62264,"Removal of spinal canal scar tissue, multiple sessions in 1 day"
62267,Aspiration of spinal disc tissue for diagnostic purposes
62268,Aspiration of fluid from cyst of spinal cord or fluid-filled cavity
62269,Biopsy of spinal cord with needle through skin
62270,Removal of cerebrospinal fluid with lower back spinal tap for diagnostic test
62272,Removal of cerebrospinal fluid with lower back spinal tap
62273,Injection of blood or blood clot into spinal canal
62281,Injection of substance into spinal canal for removal of upper spine nerve tissue
62282,Injection of substance into spinal canal for removal of lower spine nerve tissue
62284,Injection of contrast for imaging of lower spinal canal
62287,Removal of lower spine disc tissue at single or multiple levels using fluoroscopic guidance
62290,Injection of contrast for imaging of each level of lower spine
62291,Injection of contrast for imaging of each level of middle or upper spine
62292,Injection for removal of lower spine disc
62302,X-ray of upper spinal canal with review by radiologist
62303,X-ray of middle spinal canal with review by radiologist
62304,X-ray of lower spinal canal with review by radiologist
62305,X-ray of multiple regions of spinal canal with review by radiologist
62320,Injection of substance into middle or upper spine canal
62321,Injection of substance into middle or upper spine canal using imaging guidance
62322,Injection of substance into lower spine canal
62323,Injection of substance into lower spine canal using imaging guidance
62324,Insertion of tube and injection of substance into middle or upper spine canal
62325,Insertion of tube and injection of substance into middle or upper spine canal using imaging guidance
62326,Insertion of tube and injection of substance into lower spine canal
62327,Insertion of tube and injection of substance into lower spine canal using imaging guidance
62328,Removal of spinal fluid with lower back spinal tap for diagnostic test using imaging guidance
62329,Removal of cerebrospinal fluid with lower back spinal tap using imaging guidance
62350,"Insertion, revision, or repositioning of spinal canal tube for medication administration"
62351,"Insertion, revision, or repositioning of spinal canal tube for medication administration with removal of spine bone"
62355,Removal of implanted tube in spinal canal
62360,Insertion of spinal canal drug infusion device beneath skin
62361,Insertion of spinal canal drug infusion pump
62362,Insertion of programmable spinal canal drug infusion pump
62365,Removal of spinal canal drug infusion pump or device
62367,Electronic analysis of spinal canal drug infusion pump
62368,Electronic analysis and reprogramming of spinal canal drug infusion pump
62369,Electronic analysis reprogramming and refill of spinal canal drug infusion pump
62370,Electronic analysis reprogramming and refill of spinal canal drug infusion pump by physician
62380,Release of lower spinal cord and/or nerve root using endoscope
63001,"Partial removal of spine bone with exploration and/or release of upper spinal cord or nerves, 1-2 segments"
63003,"Partial removal of spine bone with exploration and/or release of middle spinal cord or nerves, 1-2 segments"
63005,"Partial removal of spine bone with exploration and/or release of lower spinal cord or nerves, 1-2 segments"
63011,"Partial removal of spine bone with exploration and/or release of sacral spinal cord or nerves, 1-2 segments"
63012,Partial removal of spine bone with release of lower spinal cord or nerves
63015,"Partial removal of spine bone with exploration and/or release of upper spinal cord or nerves, more than 2 segments"
63016,"Partial removal of spine bone with exploration and/or release of middle spinal cord or nerves, more than 2 segments"
63017,"Partial removal of spine bone with exploration and/or release of lower spinal cord or nerves, more than 2 segments"
63020,"Partial removal of spine bone with release of upper spinal cord or nerves and/or removal of disc, 1 interspace"
63030,Partial removal of spine bone with release of lower spinal cord or nerves and/or removal of disc
63035,"Partial removal of spine bone with release of upper or lower spinal cord or nerves and/or removal of disc, each additional interspace"
63040,"Partial removal of spine bone with re-exploration, release of upper spinal cord or nerves and/or removal of disc, 1 interspace"
63042,"Partial removal of spine bone with re-exploration, release of lower spinal cord or nerves and/or removal of disc, 1 interspace"
63043,"Partial removal of spine bone with re-exploration, release of upper spinal cord or nerves and/or removal of disc, each additional interspace"
63044,"Partial removal of spine bone with re-exploration, release of upper or lower spinal cord or nerves and/or removal of disc, each additional interspace"
63045,"Partial removal of spine bone with release of upper spinal cord and/or nerves, 1 segment"
63046,"Partial removal of spine bone with release of middle spinal cord and/or nerves, 1 segment"
63047,"Partial removal of spine bone with release of lower spinal cord and/or nerves, 1 segment"
63048,"Partial removal of spine bone with release of spinal cord and/or nerves, each additional segment"
63050,"Reconstruction of upper spine bone with release of upper spinal cord, 2 or more segments"
63051,Reconstruction of upper spine bone and posterior bony elements with release of upper spinal cord
63052,Partial removal of bone of single segment of spine in lower back with release of spinal cord and/or nerves during fusion of spine in lower back
