code,description
0001A,"Intramuscular administration of single severe acute respiratory syndrome coronavirus 2 (covid-19) vaccine, mrna-lnp, spike protein, preservative free, 30 mcg/0.3ml dosage, diluent reconstituted; first dose"
0001F,Heart failure composite
0001U,Red blood cell typing
0002A,"Intramuscular administration of single severe acute respiratory syndrome coronavirus 2 (covid-19) vaccine, mrna-lnp, spike protein, preservative free, 30 mcg/0.3ml dosage, diluent reconstituted; second dose"
0003A,"Intramuscular administration of single severe acute respiratory syndrome coronavirus 2 (covid-19) vaccine, mrna-lnp, spike protein, preservative free, 30 mcg/0.3ml dosage, diluent reconstituted; third dose"
0003M,"Molecular pathology test for liver disease, including non-alcohol liver disease (nash fibrosure)"
0004A,"Intramuscular administration of single severe acute respiratory syndrome coronavirus 2 (covid-19) vaccine, mrna-lnp, spike protein, preservative free, 30 mcg/0.3ml dosage, diluent reconstituted; booster dose"
0005U,Test for detecting genes associated with prostate cancer in urine
00100,Anesthesia for procedure on saliva gland
00102,Anesthesia for plastic repair of lip defect
00103,Anesthesia for procedure on eyelid
00104,Anesthesia for electroshock therapy
0011A,"Intramuscular administration of single severe acute respiratory syndrome coronavirus 2 (covid-19) vaccine, mrna-lnp, spike protein, preservative free, 100 mcg/0.5ml dosage; first dose"
00120,Anesthesia for other procedure on external middle and inner ear
00124,Anesthesia for exam of ear using an endoscope
00126,Anesthesia for incision of ear drum
0012A,"Intramuscular administration of single severe acute respiratory syndrome coronavirus 2 (covid-19) vaccine, mrna-lnp, spike protein, preservative free, 100 mcg/0.5ml dosage; second dose"
0012M,Molecular pathology test for genetic analysis of bladder tumor (cxbladder detect)
0013A,"Intramuscular administration of single severe acute respiratory syndrome coronavirus 2 (covid-19) vaccine, mrna-lnp, spike protein, preservative free, 100 mcg/0.5ml dosage; third dose"
0013M,Molecular pathology test for genetic analysis of recurrent bladder tumor (cxbladder monitor)
00140,Anesthesia for other procedure on eye
00142,Anesthesia for lens surgery
00144,Anesthesia for procedure on eye for corneal transplant
00145,Anesthesia for retinal surgery
00147,Anesthesia for procedure on eye for removal of iris
00148,Anesthesia for exam of inner eye using an endoscope
0014M,Molecular pathology test for risk of serious liver disease within 5 years (enhanced liver fibrosis (elf) test)
0015M,"Molecular pathology test for genetic analysis of kidney gland tumor (adrenal mass panel, 24 hour, urine)"
00160,Anesthesia for other procedure on nose and sinuses
00162,Anesthesia for extensive surgery on nose and sinuses
00164,Anesthesia for biopsy of soft tissue of nose and sinus
0016M,Molecular pathology test for genetic analysis of bladder tumor (decipher bladder turbt)
00170,Anesthesia for other procedure on mouth
00172,Anesthesia for procedure on mouth to repair palate deformity
00176,Anesthesia for extensive surgery on mouth
0018U,Microrna gene analysis of thyroid nodule tissue
00190,Anesthesia for other procedure on face bones or skull
00192,Anesthesia for extensive surgery on face bones or skull
00210,Anesthesia for other procedure on brain
00211,Anesthesia for removal of blood collection from brain
00212,Anesthesia for removal of fluid from brain
00214,Anesthesia for procedure to create holes in skull including x-ray imaging
00215,Anesthesia for procedure to repair skull or skull fracture
00216,Anesthesia for procedure on blood vessels in brain
00218,Anesthesia for procedure on brain while sitting up
00220,Anesthesia for procedure to drain brain and spinal cord fluid
00222,Anesthesia for procedure on nerve in brain
0023U,Dna gene analysis for acute myelogenous leukemia
0024U,Measurement of glycosylated acute phase proteins
0026U,Dna and microrna gene analysis of thyroid nodule tissue
0027U,Gene analysis (janus kinase 2) of targeted sequence exons 12-15
00300,"Anesthesia for other procedure on skin, muscles, or nerves of head, neck, and upper back"
0031A,"Intramuscular administration of single severe acute respiratory syndrome coronavirus 2 (covid-19) vaccine, dna, spike protein, adenovirus type 26 (ad26) vector, preservative free, 5x1010 viral particles/0.5ml dosage; single dose"
00320,Anesthesia for other procedure on neck area (1 year or older)
00322,Anesthesia for needle biopsy of thyroid
0034A,"Intramuscular administration of single severe acute respiratory syndrome coronavirus 2 (covid-19) vaccine, dna, spike protein, adenovirus type 26 (ad26) vector, preservative free, 5x1010 viral particles/0.5ml dosage; booster dose"
0034U,Gene analysis (thiopurine s-methyltransferase) for common variants
00350,Anesthesia for other procedure on large blood vessel of neck
00352,Anesthesia for tying large blood vessels of neck
0035U,Testing for presence of prion protein in cerebrospinal fluid
0037U,Dna gene analysis of 324 genes in solid organ tumor tissue
0038U,Measurement of vitamin d in serum
00400,"Anesthesia for other procedure on skin of arms, legs, and front body"
00402,Anesthesia for reconstruction of breast
00404,Anesthesia for removal of all or part of breast
00406,Anesthesia for removal of breast and lymph nodes
00410,Anesthesia for procedure to correct abnormal heart rhythm
0041A,"Intramuscular administration of single severe acute respiratory syndrome coronavirus 2 (covid-19) vaccine, recombinant spike protein nanoparticle, saponin-based adjuvant, preservative free, 5 mcg/0.5ml dosage; first dose"
0041U,Igm antibody detection test for borrelia burgdorferi
0042A,"Intramuscular administration of single severe acute respiratory syndrome coronavirus 2 (covid-19) vaccine, recombinant spike protein nanoparticle, saponin-based adjuvant, preservative free, 5 mcg/0.5ml dosage; second dose"
0042T,"Computed tomography (ct) of brain blood flow, volume, and timing of flow analysis with contrast"
0042U,Igg antibody detection test for borrelia burgdorferi
0043U,Igm antibody detection test for tick-borne relapsing fever borrelia group (igm)
0044A,Adm sarscov2 5mcg/0.5ml bst
0044U,Igm antibody detection test for tick-borne relapsing fever borrelia group (igg)
00450,Anesthesia for other procedure on collar bone and shoulder blade
00454,Anesthesia for biopsy of collar bone
0045U,Mrna gene analysis of 12 genes in breast ductal carcinoma in situ tumor tissue
00470,Anesthesia for other partial removal of rib
00472,Anesthesia for partial removal of rib and chest wall repair
00474,Anesthesia for extensive partial removal of rib
0047U,Mrna gene analysis of 17 genes in prostate tumor tissue
00500,Anesthesia for procedure on esophagus
0051A,"Intramuscular administration of single severe acute respiratory syndrome coronavirus 2 (covid-19) vaccine, mrna-lnp, spike protein, preservative free, 30 mcg/0.3ml dosage, tris-sucrose formulation; first dose"
0051U,Testing for presence of 31 prescription drugs in urine or blood specimen
00520,Anesthesia for other closed procedure on chest
00522,Anesthesia for closed needle biopsy of lung
00524,Anesthesia for closed drainage of lung fluid
00528,Anesthesia for closed exam of chest using an endoscope
00529,Anesthesia for closed exam of chest using an endoscope with 1 lung inflated
0052A,"Intramuscular administration of single severe acute respiratory syndrome coronavirus 2 (covid-19) vaccine, mrna-lnp, spike protein, preservative free, 30 mcg/0.3ml dosage, tris-sucrose formulation; second dose"
00530,Anesthesia for insertion of permanent heart pacemaker
00532,Anesthesia for access to central vein
00534,Anesthesia for insertion or replace of pacing heart defibrillator
00537,Anesthesia for procedure to assess heart electrical activity
00539,Anesthesia for reconstruction of airway
0053A,"Intramuscular administration of single severe acute respiratory syndrome coronavirus 2 (covid-19) vaccine, mrna-lnp, spike protein, preservative free, 30 mcg/0.3ml dosage, tris-sucrose formulation; third dose"
00540,Anesthesia for other procedure on chest
00541,Anesthesia for procedure on chest with 1 lung inflated
00542,Anesthesia for removal of tissue from around lung
00546,Anesthesia for removal of lung with chest wall repair
00548,Anesthesia for procedure on airway
0054A,"Intramuscular administration of single severe acute respiratory syndrome coronavirus 2 (covid-19) vaccine, mrna-lnp, spike protein, preservative free, 30 mcg/0.3ml dosage, tris-sucrose formulation; booster dose"
0054T,"Computer-assisted, fluoroscopic image-guided musculoskeletal surgical navigational orthopedic operation"
00550,Anesthesia for removal of breast bone tissue
0055T,Musculoskeletal surgical navigational orthopedic operation using imaging guidance
00560,Anesthesia for procedure on heart and large blood vessels
00562,Anesthesia for procedure on heart and large blood vessels using heart-lung machine (1 year or older)
00563,Anesthesia for procedure on heart and large blood vessels using heart-lung machine and stopping blood flow
00566,Anesthesia for heart artery bypass grafting
00567,Anesthesia for heart artery bypass grafting on heart-lung machine
00580,Anesthesia for heart or heart-lung transplant
0058U,Measurement of antibodies to merkel cell polyoma virus oncoprotein in serum
0059U,Test for presence of antibodies to merkel cell polyoma virus oncoprotein in serum
00600,Anesthesia for other procedure on upper spine
00604,Anesthesia for procedure on upper spine with sitting up
0061U,Spatial frequency domain imaging of skin
00620,Anesthesia for other procedure on middle spine
00625,Anesthesia for procedure on middle spine through chest wall
00626,Anesthesia for procedure on middle spine through chest wall with 1 lung inflated
00630,Anesthesia for other procedure on lower spine
00632,Anesthesia for removal of nerves in lower spine
00635,Anesthesia for spinal tap
00640,Anesthesia for manipulation or closed procedure of spine
0064A,"Intramuscular administration of single severe acute respiratory syndrome coronavirus 2 (covid-19) vaccine, mrna-lnp, spike protein, preservative free, 50 mcg/0.25ml dosage, booster dose"
0064U,Antibody testing for syphilis
0065U,Non-antibody testing for syphilis
00670,Anesthesia for extensive surgery on spine
00700,Anesthesia for other procedure on upper front abdomen
00702,Anesthesia for biopsy of liver
0071A,"Intramuscular administration of single severe acute respiratory syndrome coronavirus 2 (covid-19) vaccine, mrna-lnp, spike protein, preservative free, 10 mcg/0.2ml dosage, diluent reconstituted, tris-sucrose formulation; first dose"
00730,Anesthesia for procedure on upper rear abdomen
00731,"Anesthesia for other procedure on esophagus, stomach, or upper small bowel using an endoscope"
00732,"Anesthesia for procedure on gallbladder, pancreas, or liver using an endoscope"
00750,Anesthesia for other repair of upper abdomen hernia
00752,Anesthesia for procedure to repair upper abdominal incisional hernia and/or wound opening
00754,Anesthesia for procedure to repair upper abdominal hernia present at birth
00756,Anesthesia for procedure to repair abdominal hernia
0075T,"Insertion of stents into vertebral artery via catheter, open or accessed through the skin including radiologic supervision and interpretation, initial vessel"
00770,Anesthesia for procedure on large blood vessels in abdomen
0077U,Detection of immunoglobulin paraprotein (m-protein) in blood or urine
00790,Anesthesia for other procedure on upper abdomen
00792,Anesthesia for partial removal of liver or management of bleeding including use of an endoscope
00794,Anesthesia for removal of pancreas including use of an endoscope
00796,Anesthesia for liver transplant recipient including use of an endoscope
00797,Anesthesia for procedure on stomach for weight loss
00800,Anesthesia for other procedure on lower front abdomen
00802,Anesthesia for removal of excess tissue of lower rear abdomen
0080U,"Analysis of galectin-3-binding protein and scavenger receptor cysteine-rich type 1 protein m130 in plasma, with clinical risk factors, to evaluate probability of lung cancer"
00811,Anesthesia for other procedure on large bowel using an endoscope
00812,Anesthesia for exam of colon using an endoscope
00813,Anesthesia for procedure on small and large bowel using an endoscope
00820,Anesthesia for procedure on lower rear abdomen
00830,Anesthesia for other repair of lower abdomen hernia (1 year or older)
00832,Anesthesia for repair of abdominal wall hernia
00840,Anesthesia for other procedure on lower abdomen
00844,Anesthesia for procedure on large bowel
00846,Anesthesia for removal of uterus including use of an endoscope
00848,Anesthesia for removal of pelvic organs including use of an endoscope
0084U,Dna red blood cell antigen typing
00851,Anesthesia for tying or incision of fallopian tubes using an endoscope
00860,Anesthesia for other procedure on lower abdomen outside abdominal cavity
00862,Anesthesia for procedure on upper urinary tubes or removal of kidney for transplant
00864,Anesthesia for total removal of bladder
00865,Anesthesia for extensive removal of prostate
00866,Anesthesia for removal of adrenal gland
00868,Anesthesia for kidney transplant
00870,Anesthesia for removal of urinary bladder stone
00872,Anesthesia for shock wave therapy for urinary system stones with water bath
00873,Anesthesia for shock wave therapy for urinary system stones without water bath
00880,Anesthesia for other procedure on large blood vessel of lower abdomen
00882,Anesthesia for tying of large vein of lower abdomen
0089U,Gene expression profiling of melanoma in superficial sample collected by adhesive patch
00902,Anesthesia for procedure on anus and rectum
00904,Anesthesia for extensive procedure on perineum
00906,Anesthesia for removal of external female genitals
00908,Anesthesia for removal of prostate
0090U,Mrna gene expression profiling of 23 genes in skin melanoma tissue sample
00910,Anesthesia for other procedure on urinary system through urethra
00912,Anesthesia for removal of urinary bladder tumors including use of an endoscope
00914,Anesthesia for removal of prostate including use of an endoscope
00916,Anesthesia for procedure to control urinary system bleeding including use of an endoscope
00918,"Anesthesia for fragmenting, manipulation and/or removal of kidney stone including use of an endoscope"
00920,Anesthesia for other procedure on male genitals
00921,Anesthesia for vasectomy
00922,Anesthesia for procedure on male genital glands
00924,Anesthesia for procedure on undescended testicle
00926,Anesthesia for removal of testicle through groin
00928,Anesthesia for removal of testicle through incision in abdomen
00930,Anesthesia for relocation of undescended testicle into scrotum
00932,Anesthesia for complete amputation of penis
00938,Anesthesia for insertion of penile prosthesis
00940,Anesthesia for other procedure on female genitals
00942,Anesthesia for repair or removal of vagina and urinary procedure
00944,Anesthesia for vaginal removal of uterus
00948,Anesthesia for suture closure of cervix
0094A,"Intramuscular administration of single severe acute respiratory syndrome coronavirus 2 (covid-19) vaccine, mrna-lnp, spike protein, preservative free, 50 mcg/0.5 ml dosage, booster dose"
00952,Anesthesia for exam of uterus using an endoscope
0101T,High energy shock wave therapy of musculoskeletal system
0101U,Gene sequence analysis panel of 15 genes associated with hereditary colon cancer and related disorders
0105U,"Measurement of tumor necrosis factor receptor 1a, receptor superfamily 2 (tnfr1, tnfr2), and kidney injury molecule-1 (kim-1) in plasma to evaluate risk of rapid kidney function decline"
0106T,Measurement of sensory impairment of arm or leg using touch pressure
0106U,Evaluation of gastric emptying by measurement of radiolabeled carbon dioxide in breath specimens
0107T,Measurement of sensory impairment of arm or leg using vibration
0108T,Measurement of sensory impairment of arm or leg using cooling
0108U,Computer-assisted digital imaging of esophagus specimen slides to evaluate risk of cancer
0109T,Measurement of sensory impairment of arm or leg using heat
0109U,Dna test for detection of 4 aspergillus species
01112,Anesthesia for bone marrow aspiration and/or biopsy at pelvic bone
01120,Anesthesia for procedure on hip bone
0112U,Gene analysis for detection of infectious agent and drug resistance gene
01140,Anesthesia for amputation of leg including pelvic bone
01150,Anesthesia for extensive removal of growth of hip bone
01160,Anesthesia for closed procedure on pubic bone or pelvic joint
01170,Anesthesia for procedure on pubic bone or pelvic joint
01173,Anesthesia for repair of broken hip bone
0117U,Analysis of 11 biochemical substances in urine to evaluate likelihood of atypical biochemical function associated with pain
0118U,Measurement of transplant donor cell-free dna in transplant recipient plasma
0119U,Measurement of ceramides for assessment of heart disease risk
01200,Anesthesia for closed procedure on hip joint
01202,Anesthesia for procedure on hip joint using an endoscope
01210,Anesthesia for other procedure on hip joint
01212,Anesthesia for removal of hip bone at joint
01214,Anesthesia for total hip replacement
01215,Anesthesia for revision of total hip replacement
0121A,Adm sarscv2 bvl 30mcg/.3ml 1
01220,Anesthesia for closed procedure on upper 2/3rd of thigh bone
01230,Anesthesia for procedure on upper 2/3rd of thigh bone
01232,Anesthesia for amputation on upper 2/3rd of thigh bone
01234,Anesthesia for removal of muscle or tissue on upper 2/3rd of thigh bone
0124A,Adm sarscv2 bvl 30mcg/.3ml a
01250,"Anesthesia for procedure on nerves, muscles, tendons, and tissue of upper leg"
01260,Anesthesia for procedure on veins in upper leg
01270,Anesthesia for other procedure on artery of upper leg
01272,Anesthesia for tying of artery of upper leg
01274,Anesthesia for removal of blood clot in artery of upper leg
0129U,Gene analysis of genes associated with hereditary breast cancer and related disorders for gene sequence and duplication or deletion variants
01320,"Anesthesia for procedure on nerves, muscles, tendons, and tissue of knee"
01340,Anesthesia for closed procedure on lower 1/3rd of thigh bone
0134A,Adm sarscv2 bvl 50mcg/.5ml a
01360,Anesthesia for procedure on lower 1/3rd of thigh bone
01380,Anesthesia for closed procedure on knee joint
01382,Anesthesia for exam of knee joint using an endoscope
01390,Anesthesia for closed procedure on kneecap and/or upper part of lower leg bones
01392,Anesthesia for procedure on kneecap and/or upper part of lower leg bones
01400,Anesthesia for other procedure or exam of knee joint using an endoscope
01402,Anesthesia for procedure for total knee joint replacement
01404,Anesthesia for removal of leg at knee joint
0141A,Adm srscv2 bvl 25mcg/.25ml 1
01420,"Anesthesia for application, removal, or repair of cast to knee"
0142A,Adm srscv2 bvl 25mcg/.25ml 2
01430,Anesthesia for other procedure on vein of knee
01432,Anesthesia for repair of abnormal artery-vein formation of knee
01440,Anesthesia for other procedure on artery of knee
01442,Anesthesia for removal of blood clot of artery behind knee
01444,Anesthesia for repair of bulging (aneurysm) defect in knee artery
0144A,Adm srscv2 bvl 25mcg/.25ml a
01462,"Anesthesia for closed procedure on lower leg, ankle, and foot"
01464,Anesthesia for procedure on ankle or foot using an endoscope
01470,"Anesthesia for other procedure on nerves, muscles, tendons, and tissue of lower leg, ankle, and foot"
01472,Anesthesia for repair of achilles tendon
01474,Anesthesia for repair of calf muscle
01480,"Anesthesia for other procedure on lower leg, ankle, and foot bones"
01482,Anesthesia for open amputation below the knee
01484,"Anesthesia for open reconstruction of lower leg, ankle, and/or foot bone"
01486,Anesthesia for open total ankle joint replacement
01490,"Anesthesia for application, removal, or repair of cast to lower leg"
01500,Anesthesia for other procedure on artery of lower leg
01502,Anesthesia for removal of blood clot in artery of lower leg
01520,Anesthesia for other procedure on vein of lower leg
01522,Anesthesia for removal of obstruction in vein of lower leg
0152U,"Cell-free dna sequencing of disease-causing organisms in plasma specimen, with report for significant organisms"
0154A,Adm sarscv2 bvl 10mcg/.2ml a
01610,"Anesthesia for procedure on nerves, muscles, tendons, fascia, and bursae of shoulder and underarm"
01620,Anesthesia for closed procedure on top of arm bone and shoulder joint
01622,Anesthesia for exam of shoulder joint using an endoscope
01630,Anesthesia for other procedure on top of arm bone and shoulder joint
01634,Anesthesia for removal of arm at shoulder joint
01636,"Anesthesia for open or endoscopic amputation of arm, shoulder blade, and collar bone"
01638,Anesthesia for open or endoscopic total shoulder joint replacement
0164A,Adm srscv2 bvl 10mcg/0.2ml a
0164U,"Test for detection of antibodies associated with irritable bowel syndrome in plasma specimen, reported as elevated or not elevated"
01650,Anesthesia for other procedure on arteries of shoulder and underarm
01652,Anesthesia for repair of bulging artery of shoulder and underarm
01654,Anesthesia for bypass graft on artery of shoulder and underarm
01656,Anesthesia for bypass graft from groin artery to shoulder and underarm artery
0166U,Liver disease test panel in serum specimen
01670,Anesthesia for procedure on veins of shoulder and underarm
01710,"Anesthesia for other procedures on nerves, muscles, tendons, and tissue of upper arm and elbow"
01712,Anesthesia for procedure on tendon of elbow to shoulder
01714,Anesthesia for repair of elbow to shoulder tendon
01716,Anesthesia for procedure on tendon of upper arm muscle
0172U,"Dna gene analysis (brca1, dna repair associated and brca2, dna repair associated) for detection of mutations associated with breast cancer"
01730,Anesthesia for closed procedure on upper arm and elbow
01732,Anesthesia for exam of elbow joint using an endoscope
0173A,Adm sarscv2 bvl 3mcg/0.2ml 3
01740,Anesthesia for other procedure on elbow
01742,Anesthesia for incision or partial removal of upper arm bone
01744,Anesthesia for repair of nonhealed broken upper arm bone
0174A,Adm sarscv2 bvl 3mcg/0.2ml a
0174T,Computer algorithm analysis of digital image data
0174U,Mass spectrometry testing for 30 protein targets in tissue specimen to predict benefit of cancer therapy agents
01756,Anesthesia for extensive procedure on elbow
01758,Anesthesia for removal of cyst or growth of upper arm
01760,Anesthesia for total elbow joint replacement
01770,Anesthesia for other procedure on arteries of upper arm and elbow
01772,Anesthesia for removal of blood clot from upper arm or elbow artery
01780,Anesthesia for other procedure on veins of upper arm and elbow
01782,Anesthesia for suture of vein of upper arm and elbow
01810,"Anesthesia for procedure on nerves, muscles, tendons, and tissue of forearm, wrist, and hand"
01820,"Anesthesia for closed procedure on bones of forearm, wrist, or hand"
01829,Anesthesia for exam of wrist using an endoscope
01830,"Anesthesia for other procedure on forearm, wrist, or hand bones"
01832,Anesthesia for total wrist joint replacement
01840,"Anesthesia for other procedure on arteries of forearm, wrist, and hand"
01842,"Anesthesia for removal of blood clot in artery of forearm, wrist, and hand"
01844,Anesthesia for placement or revision of blood flow shunt
0184T,Removal of rectal tumor using an endoscope
01850,"Anesthesia for other procedure on veins of forearm, wrist, and hand"
01852,"Anesthesia for suture of forearm, wrist, or hand vein"
01860,"Anesthesia for application, removal, or repair cast to forearm, wrist and hand"
01916,Anesthesia for x-ray exam of arteries and veins using contrast
01920,Anesthesia for x-ray on heart vessels and chambers
01922,Anesthesia for x-ray or radiation therapy
01924,Anesthesia for x-ray on arteries
01925,Anesthesia for x-ray on artery of neck or heart
01926,"Anesthesia for x-ray on artery of brain, heart, or chest"
01930,Anesthesia for other x-ray on vein or lymph system
01931,Anesthesia for x-ray on vein of liver
01932,Anesthesia for x-ray on vein of chest or neck
01933,Anesthesia for x-ray on vein of brain
01937,"Anesthesia for injection, drainage or aspiration procedures on spine or spinal cord of neck or upper back accessed through skin using imaging guidance"
01938,"Anesthesia for injection, drainage or aspiration procedures on spine or spinal cord of lower back accessed through skin using imaging guidance"
01939,Anesthesia for nerve destruction procedures on spine or spinal cord of neck or upper back accessed through skin using imaging guidance
01940,Anesthesia for nerve destruction procedures on spine or spinal cord of lower back accessed through skin using imaging guidance
01941,Anesthesia for nerve modulation procedure spinal cord or repair of bone of spine of neck or upper back accessed through skin using imaging guidance
01942,Anesthesia for nerve modulation procedure spinal cord or repair of bone of spine of lower back accessed through skin using imaging guidance
01951,"Anesthesia for treatment of second and third degree burn, less than 4% of total body surface area"
01952,"Anesthesia for treatment of second and third degree burn, 4-9% of total body surface area"
01953,"Anesthesia for treatment of second and third degree burn, each additional 9% of total body surface area or less"
